{
  "schemaVersion": 1,
  "commandId": "01KZYMGHG0NPD8AF5A96MP2YFW",
  "conversationId": "remote-2026-08-13",
  "type": "message",
  "createdUtc": "2026-08-13T22:40:00Z",
  "expiresUtc": "2026-08-14T02:40:00Z",
  "requestedBy": { "entraObjectId": "00000000-0000-0000-0000-000000000000" },
  "text": "Give me a concise status update and link the latest artifact.",
  "constraints": {
    "maxWorkIqCalls": 1,
    "allowSensitiveActions": false
  }
}
